{
  "schemaVersion": 1,
  "planId": "sample-walk-and-sing-001",
  "sceneName": "Luke walks and sings across frame",
  "shotRouting": {
    "mode": "internal",
    "reason": "single character with reusable locomotion and mouth overlays",
    "confidence": 0.88
  },
  "characterStates": [
    {
      "characterId": "luke-hart",
      "characterName": "Luke Hart",
      "costumePackId": "costume_medic_desert",
      "mouthProfileId": "mouth_quarter_left_default",
      "position": {"x": 0.15, "y": 0.72},
      "facing": "screenRight",
      "headAngle": "quarterLeft",
      "bodyAngle": "quarterLeft"
    }
  ],
  "motionPrimitives": [
    {
      "primitiveId": "walk_left_to_right",
      "characterId": "luke-hart",
      "startFrame": 0,
      "durationFrames": 96,
      "loop": true,
      "speedScale": 1.0,
      "parameters": {
        "startX": 0.15,
        "endX": 0.72,
        "y": 0.72,
        "emotion": "concerned"
      }
    }
  ],
  "overlays": [
    {
      "kind": "blink",
      "targetCharacterId": "luke-hart",
      "startFrame": 8,
      "endFrame": 96,
      "parameters": {"cadence": "natural"}
    },
    {
      "kind": "breath",
      "targetCharacterId": "luke-hart",
      "startFrame": 0,
      "endFrame": 96,
      "parameters": {"intensity": 0.25}
    }
  ],
  "mouthPlans": [
    {
      "characterId": "luke-hart",
      "mouthProfileId": "mouth_quarter_left_default",
      "mode": "singing",
      "source": "lyrics",
      "timingStrategy": "vowel-led-sustain"
    }
  ],
  "qa": {
    "status": "needsReview",
    "issues": []
  }
}
